ticker,quarter,parsed_and_analyzed_facts,research_note,actual_return,error
CSTE,2019-Q2,"{""items"": [{""ticker"": ""CSTE"", ""quarter"": ""2019-Q2"", ""type"": ""Result"", ""metric"": ""Global revenue"", ""value"": ""\""$141.1 million\"""", ""reason"": ""For the second quarter 2019, global revenue was $141.1 million compared to $139.2 million in the second quarter of last year."", ""tools"": [""InspectPastStatements"", ""QueryPastCalls""]}, {""ticker"": ""CSTE"", ""quarter"": ""2019-Q2"", ""type"": ""Result"", ""metric"": ""US sales increase"", ""value"": ""\""7%\"""", ""reason"": ""In the United States, second quarter sales increased by 7% compared to the second quarter of 2018."", ""tools"": [""QueryPastCalls""]}, {""ticker"": ""CSTE"", ""quarter"": ""2019-Q2"", ""type"": ""Result"", ""metric"": ""Core US business growth"", ""value"": ""\""12%\"""", ""reason"": ""The core business in the US grew 12% year-over-year."", ""tools"": [""QueryPastCalls""]}, {""ticker"": ""CSTE"", ""quarter"": ""2019-Q2"", ""type"": ""Result"", ""metric"": ""Adjusted EBITDA"", ""value"": ""\""$19.2 million\"""", ""reason"": ""Adjusted EBITDA in the second quarter was $19.2 million, a margin of 13.6%."", ""tools"": [""InspectPastStatements"", ""QueryPastCalls""]}, {""ticker"": ""CSTE"", ""quarter"": ""2019-Q2"", ""type"": ""Result"", ""metric"": ""Adjusted diluted earnings per share"", ""value"": ""\""$0.23\"""", ""reason"": ""Adjusted diluted earnings per share in the quarter were $0.23 compared to $0.43 in the same period last year."", ""tools"": [""InspectPastStatements"", ""QueryPastCalls""]}, {""ticker"": ""CSTE"", ""quarter"": ""2019-Q2"", ""type"": ""Result"", ""metric"": ""Adjusted gross margin"", ""value"": ""\""27.3%\"""", ""reason"": ""Adjusted gross margin was 27.3% compared to 32.4% in the prior year quarter."", ""tools"": [""InspectPastStatements"", ""QueryPastCalls""]}, {""ticker"": ""CSTE"", ""quarter"": ""2019-Q2"", ""type"": ""Forward-Looking"", ""metric"": ""Full-year adjusted EBITDA outlook"", ""value"": ""\""$72 million to $80 million\"""", ""reason"": ""For the full year 2019, we reiterate our adjusted EBITDA outlook to be in the range of $72 million to $80 million."", ""tools"": []}, {""ticker"": ""CSTE"", ""quarter"": ""2019-Q2"", ""type"": ""Forward-Looking"", ""metric"": ""Anticipated revenue range"", ""value"": ""\""$550 million to $565 million\"""", ""reason"": ""We moderated our anticipated revenue to a range of $550 million to $565 million."", ""tools"": []}, {""ticker"": ""CSTE"", ""quarter"": ""2019-Q2"", ""type"": ""Forward-Looking"", ""metric"": ""US sales force expansion"", ""value"": ""\""Through 2020\"""", ""reason"": ""We expect to keep expanding the US sales force through 2020 as we see great potential in these markets."", ""tools"": []}, {""ticker"": ""CSTE"", ""quarter"": ""2019-Q2"", ""type"": ""Forward-Looking"", ""metric"": ""Long-term gross margin target"", ""value"": ""\""32% to 35%\"""", ""reason"": ""These plans support our long-term gross margin target of 32% to 35%."", ""tools"": [""InspectPastStatements"", ""CompareWithPeers"", ""QueryPastCalls""]}, {""ticker"": ""CSTE"", ""quarter"": ""2019-Q2"", ""type"": ""Forward-Looking"", ""metric"": ""Long-term adjusted EBITDA margin target"", ""value"": ""\""17% to 18%\"""", ""reason"": ""Our long-term adjusted EBITDA margin target is 17% to 18%."", ""tools"": [""InspectPastStatements"", ""CompareWithPeers"", ""QueryPastCalls""]}, {""ticker"": ""CSTE"", ""quarter"": ""2019-Q2"", ""type"": ""Risk Disclosure"", ""metric"": ""Impact of tariffs"", ""value"": ""\""Adversely impacted our markets outside the US\"""", ""reason"": ""The newly imposed duties have adversely impacted our markets outside the US, mainly in Australia and Canada."", ""tools"": [""InspectPastStatements"", ""CompareWithPeers"", ""QueryPastCalls""]}, {""ticker"": ""CSTE"", ""quarter"": ""2019-Q2"", ""type"": ""Risk Disclosure"", ""metric"": ""Performance in Australia"", ""value"": ""\""Constant currency sales were down 12%\"""", ""reason"": ""In Australia, constant currency sales were down 12% due to continued competition from Chinese manufacturers."", ""tools"": []}, {""ticker"": ""CSTE"", ""quarter"": ""2019-Q2"", ""type"": ""Risk Disclosure"", ""metric"": ""Performance in Canada"", ""value"": ""\""Constant currency sales were down 11.6%\"""", ""reason"": ""In Canada, constant currency sales were down 11.6% due to softness in housing and remodeling markets."", ""tools"": [""InspectPastStatements"", ""CompareWithPeers"", ""QueryPastCalls""]}, {""ticker"": ""CSTE"", ""quarter"": ""2019-Q2"", ""type"": ""Risk Disclosure"", ""metric"": ""Housing market conditions in Australia"", ""value"": ""\""Very soft\"""", ""reason"": ""The housing and remodeling markets in Australia remain affected by more rigid lending standards and increased mortgage rates."", ""tools"": [""InspectPastStatements"", ""CompareWithPeers"", ""QueryPastCalls""]}, {""ticker"": ""CSTE"", ""quarter"": ""2019-Q2"", ""type"": ""Risk Disclosure"", ""metric"": ""Competition from Chinese imports"", ""value"": ""\""More intense competition\"""", ""reason"": ""We have declining trends in housing completion, combined with more intense competition from Chinese imports."", ""tools"": [""InspectPastStatements"", ""CompareWithPeers"", ""QueryPastCalls""]}, {""ticker"": ""CSTE"", ""quarter"": ""2019-Q2"", ""type"": ""Sentiment"", ""metric"": ""Management's overall tone"", ""value"": ""Positive"", ""reason"": ""Management expressed excitement about the unified determination of the team to drive improvement in the business."", ""tools"": []}, {""ticker"": ""CSTE"", ""quarter"": ""2019-Q2"", ""type"": ""Sentiment"", ""metric"": ""Confidence in achieving EBITDA target"", ""value"": ""\""Gave us confidence\"""", ""reason"": ""The actions taken in the second quarter have already yielded improvement in margin and operating leverage, giving management confidence."", ""tools"": []}, {""ticker"": ""CSTE"", ""quarter"": ""2019-Q2"", ""type"": ""Macro"", ""metric"": ""Global market conditions"", ""value"": ""\""Soft global market conditions\"""", ""reason"": ""Our outlook factors in our expectation for soft global market conditions and the competitive environment to persist in many regions outside the US."", ""tools"": [""InspectPastStatements"", ""CompareWithPeers"", ""QueryPastCalls""]}, {""ticker"": ""CSTE"", ""quarter"": ""2019-Q2"", ""type"": ""Macro"", ""metric"": ""Impact of economic conditions on performance"", ""value"": ""\""Challenging times in Australia and Canada\"""", ""reason"": ""The company is experiencing more challenging times in Australia and Canada due to economic conditions."", ""tools"": [""InspectPastStatements"", ""CompareWithPeers"", ""QueryPastCalls""]}, {""ticker"": ""CSTE"", ""quarter"": ""2019-Q2"", ""type"": ""Macro"", ""metric"": ""Housing market conditions in Canada"", ""value"": ""\""Softness in housing and remodeling markets\"""", ""reason"": ""The performance in Canada was affected by softness in housing and remodeling markets."", ""tools"": [""InspectPastStatements"", ""CompareWithPeers"", ""QueryPastCalls""]}, {""ticker"": ""CSTE"", ""quarter"": ""2019-Q2"", ""type"": ""Macro"", ""metric"": ""Impact of tariffs on imports"", ""value"": ""\""Surge in imports to the US from other developing countries\"""", ""reason"": ""We have seen a surge in imports to the US from other developing countries, particularly India and Turkey, due to tariffs on Chinese imports."", ""tools"": [""InspectPastStatements"", ""CompareWithPeers"", ""QueryPastCalls""]}, {""ticker"": ""CSTE"", ""quarter"": ""2019-Q2"", ""type"": ""Macro"", ""metric"": ""Competitive environment"", ""value"": ""\""More competitive markets\"""", ""reason"": ""Revenue declined due to soft market conditions combined with more competitive markets, mainly in Australia and Canada."", ""tools"": [""InspectPastStatements"", ""CompareWithPeers"", ""QueryPastCalls""]}, {""ticker"": ""CSTE"", ""quarter"": ""2019-Q2"", ""type"": ""Result"", ""metric"": ""Revenue decline on a constant currency basis"", ""value"": ""\""2.9%\"""", ""reason"": ""On a constant currency basis, revenue declined by 2.9% compared to last year."", ""tools"": [""InspectPastStatements"", ""CompareWithPeers"", ""QueryPastCalls""]}, {""ticker"": ""CSTE"", ""quarter"": ""2019-Q2"", ""type"": ""Result"", ""metric"": ""Revenue performance in the UK"", ""value"": ""\""Continued strong momentum\"""", ""reason"": ""The UK market showed continued strong momentum, partially offsetting declines in other regions."", ""tools"": [""InspectPastStatements"", ""CompareWithPeers"", ""QueryPastCalls""]}, {""ticker"": ""CSTE"", ""quarter"": ""2019-Q2"", ""type"": ""Result"", ""metric"": ""Cash and cash equivalents"", ""value"": ""\""$99.4 million\"""", ""reason"": ""We ended the second quarter of 2019 with cash and cash equivalents of $99.4 million with no financial debt."", ""tools"": [""InspectPastStatements"", ""CompareWithPeers"", ""QueryPastCalls""]}, {""ticker"": ""CSTE"", ""quarter"": ""2019-Q2"", ""type"": ""Risk Disclosure"", ""metric"": ""Financial impact of global growth acceleration plan"", ""value"": ""\""Included in our outlook for 2019\"""", ""reason"": ""The financial impact of our global growth acceleration plan is included in our outlook for 2019."", ""tools"": [""InspectPastStatements"", ""CompareWithPeers"", ""QueryPastCalls""]}, {""ticker"": ""CSTE"", ""quarter"": ""2019-Q2"", ""type"": ""Forward-Looking"", ""metric"": ""Capacity utilization in factories"", ""value"": ""\""Expecting to increase partially\"""", ""reason"": ""We are expecting to increase partially the capacity utilization in our factories in the second half of the year."", ""tools"": [""InspectPastStatements"", ""CompareWithPeers"", ""QueryPastCalls""]}, {""ticker"": ""CSTE"", ""quarter"": ""2019-Q2"", ""type"": ""Sentiment"", ""metric"": ""Management's outlook on future growth"", ""value"": ""\""Look forward to updating you further\"""", ""reason"": ""Management expressed optimism about future growth and plans to update on progress next quarter."", ""tools"": []}, {""ticker"": ""CSTE"", ""quarter"": ""2019-Q2"", ""type"": ""Macro"", ""metric"": ""Impact of raw material prices"", ""value"": ""\""All raw material costs may impact our outlook\"""", ""reason"": ""Changes to raw material prices may impact our outlook as we move through the year."", ""tools"": []}], ""notes"": {""financials"": """", ""past"": """", ""peers"": ""### Analysis of CSTE's Performance Reasoning Compared to Comparable Firms\n\n1. **Long-term gross margin target (32% to 35%)**\n   - **CSTE's Reasoning**: CSTE emphasizes a clear long-term gross margin target, indicating a strategic focus on profitability.\n   - **Comparable Firms**: Other firms like AXGN discuss specific financial metrics such as R&D spending, which reflects a focus on investment rather than margin targets. This suggests a more growth-oriented approach compared to CSTE's emphasis on profitability.\n\n2. **Long-term adjusted EBITDA margin target (17% to 18%)**\n   - **CSTE's Reasoning**: CSTE provides a specific EBITDA margin target, indicating a structured approach to financial health.\n   - **Comparable Firms**: Firms like ECPG focus on total shareholders' equity, which may indicate a broader view of financial stability rather than specific margin targets. This difference highlights CSTE's focus on operational efficiency.\n\n3. **Impact of tariffs**\n   - **CSTE's Reasoning**: CSTE attributes market challenges to tariffs, specifically noting adverse effects outside the US.\n   - **Comparable Firms**: Other firms, such as OPRA, mention operating cash flow and marketing expenses in relation to tariffs, indicating a more operationally focused response to external pressures. CSTE's reasoning is more about market impact than operational adjustments.\n\n4. **Performance in Canada (Constant currency sales down 11.6%)**\n   - **CSTE's Reasoning**: CSTE cites specific sales declines due to market softness, indicating a direct correlation between market conditions and performance.\n   - **Comparable Firms**: Firms like AXGN discuss team growth and sales representatives, focusing on proactive measures rather than reactive performance metrics. This shows a difference in approach, with CSTE being more reactive to market conditions.\n\n5. **Housing market conditions in Australia (Very soft)**\n   - **CSTE's Reasoning**: CSTE describes the housing market as \""very soft,\"" linking it to broader economic conditions.\n   - **Comparable Firms**: Other firms, such as CBRL, discuss capital expenditures in relation to market conditions, indicating a more strategic investment approach. CSTE's focus is more on current market challenges rather than future investments.\n\n6. **Competition from Chinese imports (More intense competition)**\n   - **CSTE's Reasoning**: CSTE highlights the competitive landscape as a significant challenge, indicating a defensive stance.\n   - **Comparable Firms**: Firms like PTCT discuss risks to business in a broader context, suggesting a more holistic view of competition and market dynamics. CSTE's focus is narrower, emphasizing immediate competitive pressures.\n\n7. **Global market conditions (Soft global market conditions)**\n   - **CSTE's Reasoning**: CSTE's outlook reflects a cautious approach, anticipating ongoing challenges.\n   - **Comparable Firms**: Other firms, such as CBRL, acknowledge challenging environments but also discuss strategic responses like marketing spend increases. CSTE's reasoning lacks a proactive strategy in response to global conditions.\n\n8. **Impact of economic conditions on performance (Challenging times in Australia and Canada)**\n   - **CSTE's Reasoning**: CSTE directly links economic conditions to performance, indicating a reactive approach.\n   - **Comparable Firms**: Firms like ARGX discuss team growth and strategic expansion, suggesting a proactive approach to overcoming economic challenges. CSTE's focus is more on the negative impact rather than potential solutions.\n\n9. **Revenue decline on a constant currency basis (2.9%)**\n   - **CSTE's Reasoning**: CSTE quantifies its revenue decline, providing a clear metric for performance assessment.\n   - **Comparable Firms**: Other firms, such as OPRA, discuss operating cash flow and overall financial health, indicating a broader perspective on performance metrics. CSTE's focus is more narrowly defined.\n\n10. **Revenue performance in the UK (Continued strong momentum)**\n    - **CSTE's Reasoning**: CSTE highlights positive performance in the UK as a counterbalance to declines elsewhere.\n    - **Comparable Firms**: Firms like AXGN focus on specific operational metrics rather than regional performance, indicating a different approach to assessing success.\n\n11. **Cash and cash equivalents ($99.4 million)**\n    - **CSTE's Reasoning**: CSTE emphasizes its cash position and lack of debt, indicating financial stability.\n    - **Comparable Firms**: Other firms, such as OPRA, discuss total cash and marketable securities, reflecting a broader view of liquidity. CSTE's focus is more on immediate cash availability.\n\n12. **Financial impact of global growth acceleration plan (Included in our outlook for 2019)**\n    - **CSTE's Reasoning**: CSTE integrates its growth plan into its financial outlook, indicating a strategic alignment.\n    - **Comparable Firms**: Firms like AXGN discuss operational improvements and marketing strategies, suggesting a more dynamic approach to growth. CSTE's reasoning is more static, focusing on inclusion in forecasts.\n\n13. **Capacity utilization in factories (Expecting to increase partially)**\n    - **CSTE's Reasoning**: CSTE anticipates partial increases in capacity utilization, indicating cautious optimism.\n    - **Comparable Firms**: Other firms discuss team growth and strategic expansions, suggesting a more aggressive approach to capacity and resource management. CSTE's reasoning reflects a more conservative outlook.\n\n### Summary\nCSTE's reasoning tends to focus on specific challenges and metrics, often reflecting a reactive stance to market conditions. In contrast, comparable firms often adopt a more proactive approach, discussing strategic investments and operational improvements in response to challenges. This difference highlights CSTE's cautious outlook compared to the more dynamic strategies of its peers.""}, ""summary"": ""The earnings call reflects a mixed outlook for the company, with a notable decline in revenue and gross margins due to increased competition and adverse market conditions, particularly in Australia and Canada. While the company has reiterated its EBITDA guidance, the overall sentiment is cautious, and the year-on-year changes in net profit and gross profit indicate underlying challenges.\n\n**Summary: The company is facing significant headwinds with a year-on-year decline in net profit and gross profit, alongside a moderated revenue outlook. This suggests a likely decrease in stock price following the earnings call, Direction: 3**"", ""memory"": """", ""token_usage"": {""model"": ""gpt-4o-mini"", ""input_tokens"": 15464, ""output_tokens"": 369, ""total_tokens"": 15833, ""cost_usd"": 0.08285500000000001}}","### Analysis of CSTE's Performance Reasoning Compared to Comparable Firms

1. **Long-term gross margin target (32% to 35%)**
   - **CSTE's Reasoning**: CSTE emphasizes a clear long-term gross margin target, indicating a strategic focus on profitability.
   - **Comparable Firms**: Other firms like AXGN discuss specific financial metrics such as R&D spending, which reflects a focus on investment rather than margin targets. This suggests a more growth-oriented approach compared to CSTE's emphasis on profitability.

2. **Long-term adjusted EBITDA margin target (17% to 18%)**
   - **CSTE's Reasoning**: CSTE provides a specific EBITDA margin target, indicating a structured approach to financial health.
   - **Comparable Firms**: Firms like ECPG focus on total shareholders' equity, which may indicate a broader view of financial stability rather than specific margin targets. This difference highlights CSTE's focus on operational efficiency.

3. **Impact of tariffs**
   - **CSTE's Reasoning**: CSTE attributes market challenges to tariffs, specifically noting adverse effects outside the US.
   - **Comparable Firms**: Other firms, such as OPRA, mention operating cash flow and marketing expenses in relation to tariffs, indicating a more operationally focused response to external pressures. CSTE's reasoning is more about market impact than operational adjustments.

4. **Performance in Canada (Constant currency sales down 11.6%)**
   - **CSTE's Reasoning**: CSTE cites specific sales declines due to market softness, indicating a direct correlation between market conditions and performance.
   - **Comparable Firms**: Firms like AXGN discuss team growth and sales representatives, focusing on proactive measures rather than reactive performance metrics. This shows a difference in approach, with CSTE being more reactive to market conditions.

5. **Housing market conditions in Australia (Very soft)**
   - **CSTE's Reasoning**: CSTE describes the housing market as ""very soft,"" linking it to broader economic conditions.
   - **Comparable Firms**: Other firms, such as CBRL, discuss capital expenditures in relation to market conditions, indicating a more strategic investment approach. CSTE's focus is more on current market challenges rather than future investments.

6. **Competition from Chinese imports (More intense competition)**
   - **CSTE's Reasoning**: CSTE highlights the competitive landscape as a significant challenge, indicating a defensive stance.
   - **Comparable Firms**: Firms like PTCT discuss risks to business in a broader context, suggesting a more holistic view of competition and market dynamics. CSTE's focus is narrower, emphasizing immediate competitive pressures.

7. **Global market conditions (Soft global market conditions)**
   - **CSTE's Reasoning**: CSTE's outlook reflects a cautious approach, anticipating ongoing challenges.
   - **Comparable Firms**: Other firms, such as CBRL, acknowledge challenging environments but also discuss strategic responses like marketing spend increases. CSTE's reasoning lacks a proactive strategy in response to global conditions.

8. **Impact of economic conditions on performance (Challenging times in Australia and Canada)**
   - **CSTE's Reasoning**: CSTE directly links economic conditions to performance, indicating a reactive approach.
   - **Comparable Firms**: Firms like ARGX discuss team growth and strategic expansion, suggesting a proactive approach to overcoming economic challenges. CSTE's focus is more on the negative impact rather than potential solutions.

9. **Revenue decline on a constant currency basis (2.9%)**
   - **CSTE's Reasoning**: CSTE quantifies its revenue decline, providing a clear metric for performance assessment.
   - **Comparable Firms**: Other firms, such as OPRA, discuss operating cash flow and overall financial health, indicating a broader perspective on performance metrics. CSTE's focus is more narrowly defined.

10. **Revenue performance in the UK (Continued strong momentum)**
    - **CSTE's Reasoning**: CSTE highlights positive performance in the UK as a counterbalance to declines elsewhere.
    - **Comparable Firms**: Firms like AXGN focus on specific operational metrics rather than regional performance, indicating a different approach to assessing success.

11. **Cash and cash equivalents ($99.4 million)**
    - **CSTE's Reasoning**: CSTE emphasizes its cash position and lack of debt, indicating financial stability.
    - **Comparable Firms**: Other firms, such as OPRA, discuss total cash and marketable securities, reflecting a broader view of liquidity. CSTE's focus is more on immediate cash availability.

12. **Financial impact of global growth acceleration plan (Included in our outlook for 2019)**
    - **CSTE's Reasoning**: CSTE integrates its growth plan into its financial outlook, indicating a strategic alignment.
    - **Comparable Firms**: Firms like AXGN discuss operational improvements and marketing strategies, suggesting a more dynamic approach to growth. CSTE's reasoning is more static, focusing on inclusion in forecasts.

13. **Capacity utilization in factories (Expecting to increase partially)**
    - **CSTE's Reasoning**: CSTE anticipates partial increases in capacity utilization, indicating cautious optimism.
    - **Comparable Firms**: Other firms discuss team growth and strategic expansions, suggesting a more aggressive approach to capacity and resource management. CSTE's reasoning reflects a more conservative outlook.

### Summary
CSTE's reasoning tends to focus on specific challenges and metrics, often reflecting a reactive stance to market conditions. In contrast, comparable firms often adopt a more proactive approach, discussing strategic investments and operational improvements in response to challenges. This difference highlights CSTE's cautious outlook compared to the more dynamic strategies of its peers.

The earnings call reflects a mixed outlook for the company, with a notable decline in revenue and gross margins due to increased competition and adverse market conditions, particularly in Australia and Canada. While the company has reiterated its EBITDA guidance, the overall sentiment is cautious, and the year-on-year changes in net profit and gross profit indicate underlying challenges.

**Summary: The company is facing significant headwinds with a year-on-year decline in net profit and gross profit, alongside a moderated revenue outlook. This suggests a likely decrease in stock price following the earnings call, Direction: 3**",0.1628145903950566,
